遅,"おく_れる, おそ_い, チ",muộn,trì,Một trong những con cừu(羊) đã nghỉ lại và trở về muộn,30
駐,", チュウ","ở,sống",trú,Ông chủ(主) và con ngựa(馬) của ông ấy sống ở đây.,30
泊,"と_める, ハク",sống,bạc,Chúng tôi đã ở cái khách sạn màu trắng(白) trên bờ biển.,30
船,", セン","tàu,thuyền",thuyền,Anh ấy nói rằng con thuyền đó có thể chứa được tám(八) người,30
席,", セキ","ghế,chỗ ngồi",tịch,Có 21 chỗ ngồi trong cái quán này,30
島,"しま, トオ",đảo,đảo,Một con chim (鳥) đậu trên một ngọn núi(山) trên một hòn  đảo.,30
陸,", リク",vùng đất,lục,"Trên vùng đất  này,bạn chỉ có thể nhìnthấy một trạm xe bus",30
港,"みなと, コオ","cổng,bến tàu",cảng,Hãy gặp nhau(共) ở bến tàu,30
橋,"はし, キョオ",cầu,kiều,Có một cái cầu gỗ(木)  và một toà nhà,30
交,"まじ_わる, ま_じる, コオ",vượt qua,giao,Bố tôi (父) thì đang  băng qua ngã tư.,30
申,"もう_す, シン",nói,thân,"Thunder đã nói với tôi rằng tên anh ấy là  ""Thunder""",31
神,"かみ, かん, シン, ジン","chúa,đấng tối cao",thần,Chúng tôi cống hiến sự hi sinh với tiếng sấm gọi từ chúa,31
様,"さま, ヨオ",tình hình,dạng,"Một cái cây(木),con cừu(羊) và nước(水) tạo nên một tình hình về đồng cỏ gia súc",31
信,"しん_じる, シン",tin tưởng,tín,Tôi tin những gì bạn nói(言).,31
調,"しら_べる, ととの_う, チョオ",điều tra,"điều, điệu",Họ nói(言) họ sẽ điều tra xung quanh(周).,31
査,", サ",kiểm tra,tra,Chúng tôi đã kiểm tra ngôi mộ ở dưới cái cây(木).,31
相,"あい, ソオ, ショオ",đối mặt,"tương, tướng",Đặt đôi mắt của bạn (目) trên cây (木). Cái  cây và bạn đang đối mặt b&gt; với nhau,31
談,", ダン",nói chuyện,đàm,Hãy làm một cuộc nói chuyện gần đống lửa(火).,31
案,", アン",kế hoạch,án,Tôi dự trù đưa ra kế hoạch với những cái cây(木).,31
内,"うち, ナイ, ダイ",ở trong,nội,Một người(人) đang ở trong một cái hộp lớn,31
君,"きみ, クン","tướng,vua,chúa tể",quân,Tướng b&gt; của tôi  cung cấp  các đơn đặt hàng với dùi cui và miệng (口).,31
達,", タツ","đến,tới,đi đến",đạt,Những con chiên (羊) mang theo đất (土) cuối cùng  đến b&gt; đích của nó.,31
星,"はし, セイ, ショオ",ngôi sao,tinh,Bạn có nghĩ những ngôi sao được sinh ra  (生) từ mặt trời(日).,31
雪,"ゆき, セツ",tuyết,tuyết,"""Mưa(雨)?"".""Không,sờ đi.Nó là tuyết""",31
降,"お_りる, ふ_る, コオ",xuống,"giáng, hàng",Chúng tôi xuống ở bến xe bus.,31
直,"ただ_ちい, なお_す, チョク, ジキ","chỉnh sửa,trực tiếp",trực,"""Nhìn kìa! Nó bị vỡ rồi.""""Hãy sửa nó đi"".",31
危,"あぶ_ない, あや_うい, キ",nguy hiểm,nguy,Nhìn hòn đá ở trên cái dốc dứng kìa.Người đó thì đang  nguy hiểm,32
険,"けわ_しい, ケン","bước,giai đoạn,dốc",hiểm,Một người (人) đang tìm kiếm ở một  dốc  b&gt; núi.,32
拾,"ひろ_う, シュウ, ジュウ",tìm lại,thập,Tôi đã tìm lại được hoá đơn  10.000 yên từ thùng rác,32
捨,"す_てる, シャ","ném đi,bỏ",xả,Tôi bỏ rác vào thùng vào các ngày thứ bảy(土).,32
戻,"もど_す, レイ",trở lại,lệ,Anh ấy đã trở nên to lớn(大) và đã trở lại .Bây giờ anh ấy đang ở cửa(戸).,32
吸,"す_う, キュウ",hít vào,hấp,Tôi hít vào khói thuốc,32
放,"はな_す, ホオ","phóng thích,miễn trừ",phóng,Chúng tôi được phóng thích bên dưới lá cờ.,32
変,"か_わる, ヘン","thay đổi,kì quái",biến,Anh ấy đang mặc bộ quần áo kì quái ,32
歯,"は, シ",răng,xỉ,"Dừng(止) nói,và nhai cơm(米) kĩ với răng của bạn đi.",32
髪,"かみ, ハツ",tóc,phát,Bạn(友) tôi có tóc dài(長) ,32
絵,", カイ, エ",tranh,hội,Họ gặp (会) nhau và làm một bức tranh thêu,32
横,"よこ, オオ",bên cạnh,hoành,Bọn trẻ đang chơi bên trong một cái hộp bên cạnh một cái cây(木),32
当,"あ_たる, トオ","đâm,đập","đương, đáng",Một mũi tên  đâm vào đích,32
伝,"つた_わる, デン",truyền tải,"truyền, truyện",Hai(二) người truyền tải một thông điệp,32
細,"ほそ_る, こま_かい, サイ",mỏng,tế,Những cây lúa trên cánh đồng(田) thì mỏng như sợi dây(糸).,32
無,"な_い, ム, ブ",không,vô,Ngôi nhà bị cháy và không có thứ gì qua khỏi,32
