一,"ひと_つ, イチ, イツ",một,nhất,Một được biểu diễn bởi một ngón tay,1
二,"ふた, ニ",hai,nhị,Hai được biểu diễn bởi hai ngón tay,1
三,"み, みつ, サン",ba,tam,Ba được biểu diễn bởi ba ngón tay,1
四,"よ, よつ, シ",bốn,tứ,Một hình chữ nhật thì có bốn góc,1
五,"いつつ, ゴ",năm,ngũ,Có thể làm chữ kanji với năm que diêm không?,1
六,"む, むつ, むい, ロク",sáu,lục,Đây là cách người trung quốc thể hiện sáu với những ngón tay của họ,1
七,"なな, なの, シチ",bảy,thất,Hai cộng với năm bằng bảy,1
八,"や, やつ, ハチ",tám,bát,Nó giống như chữ kantakana　ハ giống như là 八チ(tám).,1
九,"ここの_つ, キュウ, ク",chín,cửu,"Bạn có thể đếm đến mười? Bảy, tám, chín  .. Không.",1
十,"と_う, ジュウ, ジッ",mười,thập,Kết hợp 2 ngón tay để tạo thành mười,1
百,", ヒャク",trăm,bách,"Quay số "" 100 "" 90 độ về bên phải và nó có vẻ như 百",1
千,"ち, セン",nghìn,thiên,"Thêm ノ đến 10 (十) để tạo ra  ngàn , một số lượng lớn hơn.",1
万,", マン, バン",vạn,vạn,10.000 (vạn) là một con số có 5 chữ số,1
円,"まる_い, エン","yên,vòng tròn",viên,Đây là thể hiển của 1 vòng tròn,1
口,"くち, コオ, ク",miệng,khẩu,Đây là thể hiện của một cái mồm,1
目,"め, モク, ボク",mắt,mục,Đây là thể hiện của một cái mắt,1
寒,"さむ_い, カン",lạnh,hàn,"Trong một ngày  lạnh , tôi đến nhà bạn và để lại dấu chân trên tuyết.",15
日,"ひ, か, ニチ, ジツ","ngày,mặt trời",nhật,Đây là thể hiện của mặt trời,2
月,"つき, ゲツ, ガツ","tháng,mặt trăng",nguyệt,Đây là thể hiện của  mặt trăng,2
火,"ひ, ほ, カ",lửa,hỏa,Đây là thể hiện của một ngọn lửa,2
水,"みず, スイ",nước,thủy,Nước bắn rơi xung quanh,2
木,"き, こ, ボク, モク",cây,mộc,Đây là thể hiện của một cái cây,2
金,"かね, かな, キン, コン",vàng,kim,Mọi người nói rằng có vàng ở dưới núi,2
土,"つち, ド, ト",đất,thổ,Một mầm nụ trồi ra từ đất,2
曜,", ヨオ",ngày mới,diệu,"Bắt đầu của một ngày,những con chim hót ""piyo-piyo""",2
本,"もと, ホン","sách,cơ bản",bản,"Đây là gốc của 1 cái cây..Hãy đánh đấu nó với ""ー""",2
人,"ひと, ジン, ニン",người,nhân,Một người đang đứng với hai chân,2
今,"いま, コン, キン",bây giờ,kim,Bạn đang làm gì bây giờ?,2
寺,"てら, ジ",đền,tự,"Nhìn kia,có một ngôi đền trên mặt đất",2
時,"とき, ジ",thời gian,thời,"Trong ngày,mọi người thường đánh chuông ở trong một cái đền để thông báo thời gian",2
半,"なか_ば, ハン",nửa,bán,"Hãy cắt 3 đoạn thẳng làm hai nửa,tuy nhiên chỉ đoạn thẳng đầu tiên bị đứt ",2
刀,"かたな, トオ","kiếm,dao",đao,Đây là thể hiện của một thanh kiếm,2
分,"わ_ける, ブン, フン, ブ","phút,chia",phân,Hãy chia ra.Nó sẽ thành nửa với một con dao,2
上,"あ_げる, うえ, かみ, の_ぼす, ジョオ, ショオ",trên,thượng,Đây là bên trên của một dòng,3
下,"した, しも, もと, くだ_る, さげ_る, おろ_す, カ, ゲ",dưới,hạ,Đây là bên dưới của một dòng,3
中,"なか, チュウ","giữa,trung tâm",trung,Đây là giữa của một vòng tròn,3
外,"はず_す, ガイ, ゲ",ngoài,ngoại,Bạn nên hút thuốc(トバコ) bên ngoài,3
右,"みぎ, ウ, ユウ",phải,hữu,Tôi ăn với tay phải của tôi,3
工,", コオ, ク",thủ công,công,Đây là hình dạng của cái thước của người thợ thủ công,3
左,"ひだり, サ",trái,tả,Tôi đo thước với tay trái của tôi,3
前,"まえ, ゼン",trước,tiền,Tôi chuẩn bị cho bữa tối trước khi mặt trăng lên,3
後,"のち, うし_ろ, あと, おく_れる, ゴ, コオ",sau,hậu,Một người đang đi  trở lại  trên đường phố.,3
午,", ゴ",trưa,ngọ,Chữ Kanji này có mười (十) và hai (二). Mười hai (十二) giờ là  trưa  b&gt;.,3
門,"かど, モン",cổng,môn,Đây là thể hiện của cái cổng,3
間,"あいだ, ま, カン, ケン",giữa,gian,Chúng ta có thể thấy mặt trời(日) giữa cái cổng(門).,3
東,"ひがし, トオ",đông,đông,Mặt trời (日) mọc phía đông.Có thể nhìn thấy mặt trời(日) dưới một cái cây(木).,3
西,"にし, セイ, サイ",tây,tây,Một(一) trong bốn(四) góc thì là phía tây,3
南,"みなみ, ナン, ナ",nam,nam,Hai cái cây trồng trong vườn hướng mặt về phía nam,3
北,"きた, ホク",bắc,bắc,Hai người đang quay mặt nhau bởi vì trời lạnh ở phía bắc,3
田,"た, デン","đồng,ruộng",điền,Đây là thể hiện của một cánh đồng,4
力,"ちから, リョク, リキ",sức mạnh,lực,Một người đàn ông cơ bắt thì có sức mạnh.,4
男,"おとこ, ダン, ナン",đàn ông,nam,Một người đàn ông làm việc mạnh mẽ(力) trên cánh đồng(田).,4
女,"おんな, め, ジョ, ニョ, ニョオ",đàn bà,nữ,Đây là thể hiện của người đàn bà,4
子,"ころ_す, シ, ス",trẻ con,tử,Đây là thể hiện của một đứa trẻ con,4
学,"まな_ぶ, ガク",học,học,Trẻ con(子) học trong trường.,4
生,"い_きる, う_まれる, な_える, なま, き, は_える, セイ, ショオ",sinh,sinh,Một cái cây sinh ra từ đất(土).,4
先,"さき, セン","trước,đầu",tiên,Một người đang chạy trước những người khác.,4
何,"なん, なに, カ",cái gì,hà,"Một người đang mang cái gì đó.""Đó là cái gì?""",4
父,"ちち, とう, フ",cha,phụ, Cha tôi có một bộ ria mép.,4
母,"はは, かお, ボ",mẹ,mẫu,Đây là thể hiện của một người mẹ,4
年,"とし, ネン",năm,niên,Mất một năm để gặt lúa.,4
去,"さ_る, キョ, コ","quá khứ,trước",khứ,"Tôi sống trong quá khứ b&gt;, bây giờ tôi đang bị chôn vùi trong lòng đất (土).",4
毎,", マイ",mỗi,mỗi,Mỗi người(人) có một người mẹ(母).,4
王,", オオ",vua,vương,Vị vua đang đứng,4
国,"くに, コク",đất nước,quốc,Vị vua(王) với một viên ngọc sẽ cai quản đất nước,4
見,"み_る, ケン",nhìn,kiến,"Để nhìn nhiều thứ,bạn cần một đôi mắt(目) với hai cái chân",5
行,"い-く, ゆ_く, おこな_う, コオ, ギョオ, アン",đi,"hành, hàng","Ở góc độ này,bạn phải quyết định đi đâu",5
米,"こめ, ベイ, マイ","lúa,gạo",mễ,Đây là thể hiện của một cây lúa,5
来,"く_る, き_たる, ライ",đến,lai,"Khi tháng mười đến,lúa(米) sẽ được thu hoạch.",5
良,"よい, リョオ",tốt,lương,Mọi người cảm thấy  tốt với một cái dạ dày no,5
食,"た_べる, く_う, ショク, ジキ",ăn,thực,Cái làm tôi thấy tốt(良) ở nhà là ăn,5
飲,"の_む, イン",uống,ẩm,Bạn ăn(食) và uống với cái mồm rộng của bạn,5
会,"あ_う, カイ, エ",gặp,hội,Hai(二)chúng ta sẽ gặp nhau trong một ngôi nhà.,5
耳,"みみ, ジ",tai,nhĩ,Đây là thể hiện của một cái tai,5
聞,"き_く, ブン, モン",nghe,văn,Một  người đang nghe ở cái cổng(門) với tai của họ(耳).,5
言,"い_う, こと, ゲン, ゴン",nói,ngôn,Bạn nói một vài thứ với cái miệng (口) của bạn,5
話,"はな_す, ハ",nói,thoại,Mọi người nói sử dụng một nghìn(千) từ.,5
立,"た_つ, リツ, リュウ",đứng,lập,Đây là thể hiện của một người đang đứng,5
待,"ま_つ, タイ",đợi,đãi,Tôi sẽ đợi bạn trên con đường ở phía trước ngôi đền(寺),5
周,"まわ_り, シュウ","chạy xung quanh,tuần hoàn",chu,Những gì bạn ăn sẽ trở về với đất (土). Tất cả mọi thứ theo vòng  tuần hoàn b&gt;,5
週,", シュウ",tuần,chu,Mất một tuần để đi hết(周) con đường này.,5
大,"おお_きい, ダイ, タイ",to,đại,"Khi bạn căng chân tay của bạn, bạn nhìn  lớn  b&gt;",6
小,"こ, お, ちい_さい, ショオ",nhỏ,tiểu,"Khi bạn uốn cong chân tay của bạn, bạn nhìn  nhỏ  b&gt;",6
高,"たか, たか_まる, コオ",cao,cao,Có một tòa tháp cao trên một ngôi nhà.,6
安,"やす_い, やす_らか(な), アン",rẻ,an,Người phụ nữ(女) trở nên rẻ mạt  trong ngôi nhà,6
新,"あたら_しい, シン",mới,tân,"Để bắt đầu một cái gì đó  mới  b&gt;, bạn đứng lên (立), và chặt gỗ (木) với một cái rìu.",6
古,"ふる_い, コ",cũ,cổ,"Khi bạn nghe một câu chuyện mười(十) lần,nó trở nên cũ",6
元,"もと, ゲン, ガン",khỏe mạnh,nguyên,"Nếu hai(二) người chạy cạnh nhau,họ sẽ trở nên khỏe hơn",6
気,", キ, ケ","hơi thở,khí",khí,"Nếu bạn thở nhiều, hơi thở  của bạn  có thể đi ra.",6
多,"おお_い, タ",nhiều,đa,"Có rất nhiều  ""タ。"".",6
少,"すく_ない, すこ_し, ショオ",một ít,"thiếu, thiểu","Khi bạn cắt một thứ nhỏ(小) ,bạn chỉ thu được một ít",6
広,"ひろ_い, コオ",rộng,quảng,"""Đây là ngôi nhà của tôi.Rộng,phải không nào?""",6
早,"はや_い, ソオ, サッ",sớm,tảo,Thật là sớm khi dậy vào lúc mười(十) giờ ngày chủ nhật(日）.,6
長,"なが_い, チョオ",dài,"trường, trưởng",Đây là thể hiện của một người với mái tóc dài.,6
明,"あ_かり, メイ, ミョオ",sáng,minh,Khi mặt trời(日) và mặt trăng(月) kết hợp.Nó trở nên sáng,6
好,"この_む, す_く, コオ",thích,"hảo, hiếu",Người phụ nữ(女) thích trẻ con(子).,6
友,"とも, ユウ",bạn bè,hữu, Bạn bè  cho nhau một bàn tay giúp đỡ.,6
入,"い_る, はい_る, ニュウ","nhập,vào",nhập,Một người đang chui vào cái lều.,7
出,"で_る, だ_す, シュツ, スイ","xuất,ra",xuất,Ra b&gt; là theo lối này.,7
市,"いち, シ","thành phố,chợ",thị,Mọi người đi đến chợ để mua sắm.,7
町,"まち, チョオ","thị trấn,phố",đinh,Sử dụng được ruộng lúa (田) và các tuyến đường trong thị trấn,7
村,"むら, ソン",làng,thôn,Có một ngôi làng bên ngoài cái cây,7
雨,"あめ, あま, ウ",mưa,vũ,Chữ kanji này được tạo ra từ mây và những giọt mưa,7
電,", デン",điện,điện,Trời thì đang mưa(雨) và sét đánh lên trên cánh đồng(田).,7
車,"くるま, シャ",xe,xa,Đây là thể hiện của một cái xe,7
馬,"うま, ま, バ",ngựa,mã,Đây là thể hiện của một con ngựa,7
駅,", エキ",nhà ga,dịch,Có con ngựa(馬) và người đang vác đồ ở nhà ga,7
社,"やしろ, シャ","công ty,đền",xã,Người cung cấp các thứ và cầu nguyện cho vụ mùa bội thu tại một cái  đền  b&gt;,7
校,", コオ",trường,hiệu,Cha(父) tôi đến trường để đón tôi.,7
店,"みせ, テン",cửa hàng,điếm,"Ở quầy hàng,cà chua(トマト) đang được bày trên một cái hộp",7
銀,", ギン",bạc,ngân,Bạc thì không tốt như vàng(金).,7
病,"やま_い, や_む, ビョオ, ヘイ",ốm,bệnh,Một người ốm đang ngủ trong bệnh viện.,7
院,", イン","tổ chức,cơ sở",viện,Họ đã khỏe (良) và rời bệnh viện ( tổ chức  b&gt;) để về nhà.,7
休,"やす_む, キュウ",nghỉ ,hưu,Một người đang nghỉ dưới cái cây(木).,8
走,"はし_る, ソオ",chạy,tẩu,Tôi  chạy  ngay cả khi tôi đang bị phủ đất (土).,8
起,"お_きる, おこ_る, キ",thức dậy,khởi,Tôi sẽ chạy(走) bởi vì tôi thức dậy muộn.,8
貝,"かい, バイ",động vật có vỏ,bối,Đây là hình dạng của  động vật có vỏ ,8
買,"か_う, バイ",mua,mãi,"Chúng tôi sử dụng để sử dụng vỏ (贝) để  mua  b&gt; các thứ, bây giờ chúng tôi sử dụng hóa đơn.",8
売,"う_る, バイ",bán,mại,Một người đang bán một vài thứ.,8
読,"よ_む, ドク, トク, トオ",đọc,độc,"Anh ấy nói(言),""Đọc quyển sách bán(売) chạy nhất đi.""",8
書,"か_く, ショ",viết,thư,"Với một thanh cọ,tôi viết chữ kanji ""日""",8
帰,"かえ_る, キ",trở lại,quy,Chim nhạn trở lại với tổ của chúng,8
勉,", ベン",làm lợi,miễn,Người đàn ông đang làm lợi với sức mạnh của ông ấy(強).,8
弓,"ゆみ, キュウ",cung,cung,Đây là thể hiện của một cái cung,8
虫,"むし, チュウ",con bọ,trùng,Đây là thể hiện của một con bọ,8
強,"つよ_い, し_いる, キョオ, ゴオ","khỏe,mạnh mẽ","cường, cưỡng",Cả hai loài bọ cánh cứng (虫) và mũi tên (弓) đều mạnh mẽ  b&gt;,8
持,"もつ, ジ","tổ chức,tiến hành",trì,Tôi đến chùa (寺)  tổ chức  cầu nguyện.,8
名,"な, メイ, ミョオ",tên,danh,Tên anh ấy là Taro(タロ).,8
語,"かた_る, ゴ","từ,ngôn ngữ",ngữ,Họ nói(言) năm(五) ngôn ngữ.,8
春,"はる, シュン",xuân,xuân,Mùa xuân đã đến.Ba(三) người(人) nhìn về mặt trời(日).,9
夏,"なつ, カ, ゲ",hạ,hạ,Trời rất nóng trong mùa hè b&gt;. Một người sụp đổ trong cái bóng,9
秋,"あき, シュウ",thu,thu,"Vào mùa thu  b&gt;, cây lúa và lá chuyển thành màu sắc của lửa (火)",9
冬,"ふゆ, トオ",đông,đông,"Trong  mùa đông  b&gt;, nó thì trơn khi bạn đi bộ trên băng.",9
朝,"あさ, チョオ",sáng,triều,Đó là buổi sáng của ngày 10 tháng 10(十月十日).,9
昼,"ひる, チュウ",ban ngày,trú,Chúng tôi trú mình trong bóng râm ban ngày khi mặt trời (日)lên cao,9
夕,"ゆ_う, セキ",hoàng hôn,tịch,"Vào hoàng hôn  b&gt;, bạn nhìn thấy mặt trăng và các loài chim.",9
方,"かた, ホオ","hướng,người",phương,Hãy đi theo hướng của lá cờ,9
晩,", バン",tối,vãn,Đứa trẻ vội vàng trở về nhà trước buổi tối,9
夜,"よる, よ, ヤ",đêm,dạ,"Vào đêm,một người với cái mũ dài đang ngắm mặt trăng và những đám mây",9
心,"こころ, シン",trái tim,tâm,Trái tim của tôi đang đập.,9
手,"て, た, シュ",tay,thủ,Đây là thể hiện của bàn tay,9
足,"あし, た_る, ソク",chân,túc,Căng  chân  b&gt; của bạn lên và chạy.,9
体,"からだ, タイ, テイ",cơ thể,thể,"Khi cơ thể của bạn bị thương,hãy băng bó và nghỉ ngơi(休).",9
首,"くび, シュ","cổ,đầu",thủ,Đây là thể hiện của một người với cái cổ dài,9
道,"みち, ドオ, トオ",đường,đạo,Một người đang vươn cái cổ(首) như kiểu đang đợi một ai đó trên đường,9
山,"やま, サン",núi,sơn,Đây là thể hiện của một ngọn núi,10
川,"かわ, セン",sông,xuyên,Dòng sông chạy qua nó,10
林,"はやし, リン",rừng nhỏ,lâm,Hai cái cây (木) trở thành một rừng nhỏ,10
森,"もり, シン",rừng,sâm,Ba cái cây(木) trở thành một cánh rừng,10
空,"そら, から, あ_く, クウ",bầu trời,không,Mở cửa sổ và đo  bầu trời  b&gt; với thước đo của người thợ thủ công,10
海,"うみ, カイ",biển,hải,Chúng tôi đến biển và bơi mỗi(舞)ngày.,10
化,"ば_ける, ば_かる, カ, ケ",thay đổi,hóa,Một người đứng lên và ngồi xuống.Anh ấy thay đổi vị trí của mình,10
花,"はな, カ",hoa,hoa,Cỏ thay đổi (化) trong những bông hoa,10
天,"あめ. あま, テン","thiên đường,trời",thiên,Tôi nghĩ về thiên đường với những cánh tay mở rộng,10
赤,"あか, セキ, シャク",đỏ,xích,Bạn đưa đất (土) trên ngọn lửa để làm những viên gạch đỏ ,10
青,"あお_い, セイ, ショオ",xanh,thanh,Cỏ xanh và mặt trăng xanh(月).,10
白,"しろ_い, カク, ビャク",trắng,bạch,Có một tòa nhà màu  trắng,10
黒,"くろ_い, コク",đen,hắc,Cánh đồng(田) bị đốt cháy và đất trở nên(土) đen,10
色,"いわ, ショク, シキ",màu sắc,sắc,Đây là hình dạng của một vòng xoáy của hai  màu sắc  b&gt;,10
魚,"さかな,うお, ギョ",cá,ngư,Đây là thể hiện của một con cá,10
犬,"いぬ, ケン",chó,khuyển,Đây là thể hiện của một con chó,10
料,", リョオ",thành phần,liệu,Bạn đo gạo (米) và các  thành phần   khác trên thang điểm.,11
理,", リ",hợp lý,lí,Vị vua (王) nghĩ ra những điều  hợp lý  thực hiện chúng trên  những cánh đồng lúa (田).,11
反,"そ_る, ハン, ホン, タン",phản đối,phản,Tôi  phản đối  nó,11
飯,"めし, ハン","gạo,lúa",phạn,Họ phản đối (反) thói quen ăn uống (食) để nhiều  gạo  b&gt;,11
牛,"うし, ギュウ",bò,ngưu,Đây là hình dạng của một một sừng  bò  b&gt;,11
豚,"ぶた, トン",lợn,đồn,Một con lợn đang nhìn về mặt trăng(月).,11
鳥,"とり, チョオ",chim,điểu,Đây là thể hiện của một con chim,11
肉,", ニク",thịt,nhục,Đây là thể hiện của một miếng thịt,11
茶,", チャ, サ",trà,trà,Hai người đang uống trà,11
予,", ヨ",nâng cao,dự,Một người mẹ (マザー) sắp xếp (アレンジ) một đứa trẻ trên  cao ,11
野,"の, ヤ","lĩnh vực,khu vực",dã,Họ đi đến  lĩnh vực  đó trong sự tiến bộ (予).,11
菜,"な, サイ",rau,thái,Bạn lấy rau từ cỏ và cây(予).,11
切,"き_る, セツ, サイ",cắt,thiết,Bảy七) samurai đã cắt với thanh kiếm (刀)  của họ,11
作,"つく_る, サク, サ",làm,tác,Một người với cái cưa đang làm gì đó.,11
未,", ミ", chưa,vị,Cái cây(木) này không phát triển nữa,11
味,"あじ, ミ",mùi vị,vị,"Tôi không biết mùi vị của nó như thế nào ,bởi vì tôi chưa(未) ăn nó",11
音,"おと, ね, オン, イン",âm thanh,âm,"Khi mặt trời(日) mọc,người đang đứng(立) và tạo ra âm thanh",12
楽,"たのし_む, ガク, ラク","vui,thoải mái","lạc, nhạc",Chúng ta hãy  vui vẻ  đánh những cái trống (白) trắng trên mảnh  gỗ(木) đứng ,12
歌,"うた_う, カ",hát,ca,Người (人) đang  hát b&gt; với cái miệng (口) mở rộng.,12
自,"みずか_ら, ジ, シ","tự,chính bản thân",tự,"Tại Nhật Bản, cử chỉ chỉ vào mũi của một người có nghĩa là ""chính tôi """,12
転,"ころ_がる, テン","lăn,quay",chuyển,Tôi bị rơi từ trên xe  (车) đang  lăn  b&gt;,12
乗,"の_る, ジョオ",leo lên,thừa,Một người đứng 立 trên cây (木) để leo lên nhánh,12
写,"うつ_す, シャ",ảnh,tả,Đây là bức ảnh của người đàn ông vói cái mũ,12
真,"ま, シン","đúng,chân thật",chân,Chiếc ti vi này trình diễn hình ảnh chân thật,12
台,", ダイ, タイ",đứng,đài,Tôi thì đang đứng,12
央,", オオ",trung tâm,ương,Người (人) là  trung tâm  b&gt; của sơ đồ,12
映,"うつ_す, はえ_る, エイ",chiếu ,ánh,Trung tâm (央) sơ đồ của bộ phim thì được  chiếu b&gt; trên màn hình.,12
画,", ガ, カク",tranh,"họa, hoạch",Vẽ một  bức tranh  của một ruộng lúa (田) trên vải.,12
羊,"ひつじ, ヨオ",cừu,dương,Đây là thể hiện của một con cừu,12
洋,", ヨオ",nước ngoài,dương,Cừu (羊) đã đến Nhật Bản từ nước ngoài ,12
服,", フク",quần áo,phục,"Dưới ánh trăng (月), bạn treo  quần áo  của bạn",12
着,"き_る, つ_く, チャク, ジャク",mặc,trước,Tôi nhìn thấy một con cừu (羊)  mặc  một chiếc áo len.,12
家,"いえ, や, カ, ケ",nhà,gia,"Trước đây,mọi người giữ những con lợn ở trong nhà",13
矢,"や, シ",mũi tên,thỉ,Đây là hình dạng của một  mũi tên ,13
族,", ゾク",gia đình,tộc,"Dưới lá cờ, người bảo vệ  gia đình của họ với mũi tên  (矢) của họ",13
親,"おや, した_しい, シン",bố mẹ,thân,Cha mẹ đang đứng(立) trên đỉnh của cái cây(木) để nhìn(見) con của họ.,13
兄,"あに, にい, ケイ, キョオ",anh trai,huynh,Anh trai tôi dangđi với cái miệng (口) rộng,13
姉,"あね, ねえ, シ",chị gái,tỉ,Chị gái  tôi  là người phụ nữ(女) sống ở một thành phố(市).,13
弟,"おとうと, テイ, ダイ, デ",em trai,đệ,Em trai  tôi đang chơi với cái cung(弓).,13
妹,"いもうと, マイ",em gái,muội,"Người con gái(女) và cái cây chưa(未) phát triển.Nó nghĩa là  em gái"" của tôi",13
私,"わたし_く, シ",tôi,tư,Đây là cây lúa được  tôi  chăm sóc,13
夫,"おっと, フ, フウ",chồng,phu,Chồng tôi và tôi thì luôn là hai (二) người (人) bên nhau.,13
妻,"つま, サイ",vợ,thê,Người phụ nữ (女) đang nắm giữ một cây chổi là  vợ của tôi ,13
主,"めし, おも(な), シュ, ス","chính,chủ",chủ,Người đàn ông với cái mũ là ông chủ(người chủ).,13
住,"す_む, ジュウ",sống,"trú, trụ",Người chủ(主) sống với một vài người,13
糸,"いと, シ","sợi dây,đường thằng,chủ đề",mịch,Đây là hình dạng của các đường thẳng   trên một máy in.,13
氏,"うじ, シ",họ tên,thị,Họ tên b&gt; của tôi thì trên thẻ tên.,13
紙,"かみ, シ",giấy,chỉ,"Viết tên họ của bạn (氏) trên giấy   b&gt;, và đưa các chủ đề (糸) thông qua.",13
教,"おし_える, キョオ",dạy,giáo,Một người già đang dạy một đứa trẻ(子).,14
室,"むろ, シツ",phòng,thất,Tôi ở trong phòng của tôi vào thứ bảy (土).,14
羽,"はね, ウ",đôi cánh,vũ,Đây là hình dạng của đôi cánh,14
習,"なら_う, シュウ",học,tập,Chim vỗ cánh (羽) trên một tòa nhà màu trắng (白) và  học  để bay.,14
漢,", カン",người trung quốc,hán,Người chồng(夫)Trung Quốc băng qua sông với cỏ trên đầu ,14
字,"あざ, ジ","chữ,kí tự",tự,Đứa trẻ(子) học chữ trong nhà.,14
式,", シキ","lễ,phong cách",thức,Đây là   lễ cưới của tôi,14
試,"こころ_みる, ため_す, シ",cố gắng,thí,"Tại lễ (式): ""Bạn sẽ theo anh ta miễn là  cả hai sẽ sống bên nhau"" tôi đã nói (言) ""Tôi sẽ  cố gắng """,14
験,", ケン, ゲン",kiểm tra,nghiệm,"Trước khi trèo lên núi,một người(人) đã luyện tập con ngựa(馬).",14
宿,"やど, シュク",nhà trọ,túc,Nhà trọ  này có thể phục vụ 100 (百) người.,14
題,", ダイ",chủ đề,đề,Các nhà báo tìm một  chủ đề  sử dụng đầu của họ (头) và chân (足).,14
文,"ふみ, ブン, モン","kí tự,nhân vật",văn,Một mô hình trên chiếc bình cũ đã trở thành một  nhân vật ,14
英,", エイ",tuyệt vời,anh,Người đàn ông ở trung tâm (央) là một anh hùng (người tuyệt vời ) sinh ra từ phong trào quần chúng.,14
質,", シツ, シチ, チ",chất lượng,chất,Tôi cắt một vỏ lớn (贝) với hai cái rìu và kiểm tra  chất lượng b&gt; của nó ,14
問,"と_う, とん, モン",câu hỏi,vấn,"Ở cái cổng(門),tôi hỏi những câu hỏi",14
説,"と_く, セツ, ゼイ",giải thích,thuyết,Anh trai tôi (兄) đang  giải thích ,14
遠,"とお_い, エン, オン",xa,viễn,"Vào thứ bày(土),tôi đi xa.",15
近,"ちか_い, キン",gần,cận,Chặt cây bằng rìu và điểm đến của bạn sẽ trở nên  gần hơn,15
者,"もの, シャ",người,giả,Mỗi người  phát triển qua mỗi ngày(日).,15
暑,"あつ_い, ショ",nóng,thử,Một người(人) đứng dưới mặt trời(日) cảm thấy nóng,15
重,"おも_い, かさ_なる, ジュウ, チョオ",nặng,"trọng, trùng",Một nghìn(千) quyển sách thì nặng,15
軽,"かる_い, ケイ",đèn,khinh,Đèn ô tô(車) sẽ bật nếu bạn đẩy nó bằng tay của bạn,15
低,"ひく_い, テイ",thấp,đê,"""Tại sao tôi lại bị gạch chân họ tên (氏)của tôi?"". ""Bởi vì mức của bạn là  thấp  b&gt;""",15
弱,"よわ_い, ジャク",yếu,nhược,Những con chim nhỏ thì yếu,15
悪,"わる_い, アク, オ","tồi,kém","ác, ố",Cảm xúc  tồi tệ  b&gt;trong trái tim của họ (心).,15
暗,"くら_い, アン",tối,ám,Ở trong bóng tối và bạn có thể nghe thấy âm thanh(音).,15
太,"ふと_い, タイ, タ",dày,thái,Đây là một bản ghi dày ,15
豆,"まめ, トオ, ズ",hạt đậu,đậu,Nó là một cái cốc có chứa những hạt đậu,15
短,"みじか_い, タン",ngắn,đoản,Mũi tên (矢) và hạt đậu (豆) thì đều  ngắn  b&gt;,15
光,"ひか_る, コオ",ánh sáng,quang,Đây là hình dạng của tia  ánh sáng  b&gt;,15
風,"かぜ, フウ, フ",gió,phong,Con bọ (虫) đang tránh  gió  dưới cái lá,15
